<?xml version="1.0" encoding="UTF-8"?>
<exchange xmlns="http://interface.technikboerse.com/XMLSchema" xmlns:xsi="http://www.w3.org/2001/XMLSchema-instance" xsi:schemaLocation="http://interface.technikboerse.com/xsd/export.xsd">
  <senderName>technikboerse</senderName>
  <exportDate>2012-05-04T13:31:42+02:00</exportDate>
  <transferMode>update</transferMode>
  <backLogDays>3</backLogDays>
  <dealersDeleted/>
  <adsDeleted/>
  <dealers>
    <!--49307908-->
    <dealer guid="81d32e91-9db3-5899-be2a-b4795fb56491" id="49307908">
      <info id="50500" name="company_name">dieMayrei GmbH</info>
      <info id="50501" name="street">Joseph-Gänsler-Str. 4</info>
      <info id="50502" name="zipcode">86609</info>
      <info id="50503" name="city">Donauwörth</info>
      <info id="50504" name="country_iso3166_1">DE</info>
      <info id="50505" name="phone">0049 (0) 1805826773</info>
      <info id="50506" name="mobile_phone">0049 12345</info>
      <info id="50507" name="email">tobias.beck@diemayrei.de</info>
      <info id="50509" name="contact_person">Herr Tobias Beck</info>
      <info id="50512" name="fax">0049 (0) 0906 7057777</info>
      <info id="50513" name="url">http://www.diemayrei.de</info>
      <info id="50516" name="logo"/>
      <info id="50517" name="type">commercial</info>
      <created>2008-07-11T00:00:00+02:00</created>
      <modified>2012-05-04T11:32:00+02:00</modified>
      <ads>
        <!--488091-->
        <ad guid="a8f1ad52-c2eb-5981-a627-4fb5226f1d71" id="488091" category_id="210" category_name="Mähdrescher" parent_category_name="Mähdrescher">
          <info id="50000" name="internal_ad_id" data_type="string"><![CDATA[1489]]></info>
          <info id="50001" name="manufacturer_name" data_type="enum">Claas</info>
          <info id="50002" name="model" data_type="string"><![CDATA[Lexion 480]]></info>
          <info id="50003" name="power" unit="PS" data_type="int">375</info>
          <info id="50004" name="year_of_manufacturer" data_type="int">2001</info>
          <info id="50005" name="operating_hours" data_type="int">1100</info>
          <info id="50011" name="location_info" data_type="string"><![CDATA[]]></info>
          <info id="50012" name="condition" data_type="enum">used</info>
          <info id="50016" name="description" data_type="string"><![CDATA[]]></info>
          <info id="50017" name="location_zipcode" data_type="string"><![CDATA[]]></info>
          <info id="50018" name="location_city" data_type="string"><![CDATA[]]></info>
          <info id="50020" name="is_customer_mission" data_type="boolean">0</info>
          <info id="2011" name="Klimaanlage" data_type="boolean">1</info>
          <info id="2030" name="Breite" unit="m" data_type="float">7,50</info>
          <info id="2031" name="Pendelausgleich" data_type="boolean">1</info>
          <info id="2033" name="Schneidwerkswagen" data_type="boolean">1</info>
          <info id="2035" name="Spreuverteiler" data_type="boolean">1</info>
          <info id="2036" name="Strohhäcksler" data_type="boolean">1</info>
          <info id="2037" name="Verlustmessung" data_type="boolean">1</info>
          <contact_ids>
            <contact_id>6268</contact_id>
            <contact_id>6538</contact_id>
          </contact_ids>
          <!--6.800.000 € (5.714.286 € zzgl. 19 % MwSt)-->
          <price currency="EUR" taxtype="inclusive" tax_percentage="0.190">6800000</price>
          <created>2005-09-19T15:57:32+02:00</created>
          <modified>2012-05-04T13:31:40+02:00</modified>
          <images>
            <image image_name="phpVf8xNQ.jpg"><![CDATA[http://interface.technikboerse.com/thumbnails/49307908/488091/phpVf8xNQ_400x300.jpg]]></image>
          </images>
        </ad>
        <!--488092-->
        <ad guid="2b688730-2da4-5767-a8f0-75aa24875111" id="488092" category_id="210" category_name="Mähdrescher" parent_category_name="Mähdrescher">
          <info id="50000" name="internal_ad_id" data_type="string"><![CDATA[0583]]></info>
          <info id="50001" name="manufacturer_name" data_type="enum">Claas</info>
          <info id="50002" name="model" data_type="string"><![CDATA[Lexion 460 Evo]]></info>
          <info id="50003" name="power" unit="PS" data_type="int">300</info>
          <info id="50004" name="year_of_manufacturer" data_type="int">2002</info>
          <info id="50005" name="operating_hours" data_type="int">1235</info>
          <info id="50011" name="location_info" data_type="string"><![CDATA[Donauwörth]]></info>
          <info id="50012" name="condition" data_type="enum">used</info>
          <info id="50017" name="location_zipcode" data_type="string"><![CDATA[]]></info>
          <info id="50018" name="location_city" data_type="string"><![CDATA[]]></info>
          <info id="50020" name="is_customer_mission" data_type="boolean">0</info>
          <info id="2011" name="Klimaanlage" data_type="boolean">1</info>
          <info id="2030" name="Breite" unit="m" data_type="float">7,50</info>
          <info id="2031" name="Pendelausgleich" data_type="boolean">1</info>
          <info id="2033" name="Schneidwerkswagen" data_type="boolean">1</info>
          <info id="2034" name="Siebkastenhangausgleich" data_type="boolean">1</info>
          <info id="2035" name="Spreuverteiler" data_type="boolean">1</info>
          <info id="2036" name="Strohhäcksler" data_type="boolean">1</info>
          <info id="2037" name="Verlustmessung" data_type="boolean">1</info>
          <contact_ids>
            <contact_id>6268</contact_id>
            <contact_id>6538</contact_id>
          </contact_ids>
          <!--Keine Angabe-->
          <price currency="EUR" taxtype="inclusive" tax_percentage="0.190">0</price>
          <created>2005-09-19T15:59:42+02:00</created>
          <modified>2012-05-04T13:31:40+02:00</modified>
          <images>
            <image image_name="phpIZES3N.jpg"><![CDATA[http://interface.technikboerse.com/thumbnails/49307908/488092/phpIZES3N_400x300.jpg]]></image>
          </images>
        </ad>
        <!--488093-->
        <ad guid="81a6b497-ee9f-5295-93a3-1ff919aa0f2f" id="488093" category_id="210" category_name="Mähdrescher" parent_category_name="Mähdrescher">
          <info id="50000" name="internal_ad_id" data_type="string"><![CDATA[0582]]></info>
          <info id="50001" name="manufacturer_name" data_type="enum">Claas</info>
          <info id="50002" name="model" data_type="string"><![CDATA[Lexion 460 Evo]]></info>
          <info id="50003" name="power" unit="PS" data_type="int">300</info>
          <info id="50004" name="year_of_manufacturer" data_type="int">2002</info>
          <info id="50005" name="operating_hours" data_type="int">1234</info>
          <info id="50011" name="location_info" data_type="string"><![CDATA[Donauwörth]]></info>
          <info id="50012" name="condition" data_type="enum">used</info>
          <info id="50016" name="description" data_type="string"><![CDATA[]]></info>
          <info id="50017" name="location_zipcode" data_type="string"><![CDATA[]]></info>
          <info id="50018" name="location_city" data_type="string"><![CDATA[]]></info>
          <info id="50020" name="is_customer_mission" data_type="boolean">0</info>
          <info id="2002" name="Allrad" data_type="boolean">1</info>
          <info id="2003" name="Autocontour" data_type="boolean">1</info>
          <info id="2004" name="Bordcomputer" data_type="boolean">1</info>
          <info id="2011" name="Klimaanlage" data_type="boolean">1</info>
          <info id="2017" name="Rapsschneidwerk" data_type="boolean">1</info>
          <info id="2019" name="Rapstrenner links" data_type="enum"><![CDATA[136]]></info>
          <info id="2020" name="Rapstrenner rechts" data_type="enum"><![CDATA[136]]></info>
          <info id="2030" name="Breite" unit="m" data_type="float">7,50</info>
          <info id="2031" name="Pendelausgleich" data_type="boolean">1</info>
          <info id="2033" name="Schneidwerkswagen" data_type="boolean">1</info>
          <info id="2034" name="Siebkastenhangausgleich" data_type="boolean">1</info>
          <info id="2035" name="Spreuverteiler" data_type="boolean">1</info>
          <info id="2036" name="Strohhäcksler" data_type="boolean">1</info>
          <info id="2037" name="Verlustmessung" data_type="boolean">1</info>
          <contact_ids>
            <contact_id>6268</contact_id>
            <contact_id>6538</contact_id>
          </contact_ids>
          <!--79.000 € (66.387 € zzgl. 19 % MwSt)-->
          <price currency="EUR" taxtype="inclusive" tax_percentage="0.190">79000</price>
          <created>2010-05-26T16:01:05+02:00</created>
          <modified>2012-05-04T13:31:41+02:00</modified>
          <images>
            <image image_name="53b7dd352ff4a245d215a808f3c48a3a.jpg"><![CDATA[http://interface.technikboerse.com/thumbnails/49307908/488093/53b7dd352ff4a245d215a808f3c48a3a_400x300.jpg]]></image>
          </images>
        </ad>
        <!--488096-->
        <ad guid="389e0960-ee40-5763-b3cc-1ef5ff926040" id="488096" category_id="210" category_name="Mähdrescher" parent_category_name="Mähdrescher">
          <info id="50000" name="internal_ad_id" data_type="string"><![CDATA[0291]]></info>
          <info id="50001" name="manufacturer_name" data_type="enum">Claas</info>
          <info id="50002" name="model" data_type="string"><![CDATA[DO 208 Mega II]]></info>
          <info id="50003" name="power" unit="PS" data_type="int">239</info>
          <info id="50004" name="year_of_manufacturer" data_type="int">1996</info>
          <info id="50005" name="operating_hours" data_type="int">2217</info>
          <info id="50011" name="location_info" data_type="string"><![CDATA[DE-86609 Donauwörth]]></info>
          <info id="50012" name="condition" data_type="enum">used</info>
          <info id="50016" name="description" data_type="string"><![CDATA[]]></info>
          <info id="50017" name="location_zipcode" data_type="string"><![CDATA[]]></info>